{
  "assessments" : [

  ],
  "evaluationID" : "3C7B7A04-161C-461C-9816-139E9073FFA5",
  "expectedContentIdentities" : {

  },
  "expectedReviewDigest" : "035f6536118a6f6f372e1d9923e99c74820d9983cf3a3746013ef827e25ac10c",
  "kind" : "airs.review-policy-request",
  "mode" : "historicalRecord",
  "policy" : "incomplete-policy.json",
  "reviewArchive" : "owned.airsreview",
  "schemaVersion" : 1
}